{
  "repoUrl": "https://github.com/example/agentattest",
  "baseCommit": "0123456789abcdef0123456789abcdef01234567",
  "requiredLevel": "policy-grade",
  "subjects": [
    {
      "name": "patch.diff",
      "algorithm": "sha256",
      "digest": "aaaaaaaaaaaaaaaaaaaaaaaaaaaaaaaaaaaaaaaaaaaaaaaaaaaaaaaaaaaaaaaa"
    },
    {
      "name": "repo-tree",
      "algorithm": "sha256",
      "digest": "bbbbbbbbbbbbbbbbbbbbbbbbbbbbbbbbbbbbbbbbbbbbbbbbbbbbbbbbbbbbbbbb"
    }
  ],
  "verifiedSigner": "sigstore:github:example-agent",
  "verifiedBuilderId": "https://github.com/example/agentattest/.github/workflows/agentattest.yml@refs/heads/main",
  "verifiedWorkflowRef": "https://github.com/example/agentattest/.github/workflows/agentattest.yml@refs/heads/main",
  "verifiedIssuer": "https://token.actions.githubusercontent.com",
  "allowSelfHostedRunners": false
}
